cryptocurrency,username,user_id,followers_count,tweet_text,created_date,retweet_count,reply_count,like_count,sentiment#bitcoin,rogerkver,176758255,650488,b'The message from #Bitcoin maximalists like @michael_saylor is \\u201cpay your taxes\\u201d and \\u201cobey your masters\\u201d. https://t.co/vdRXroyKbo',2021-03-09T14:58:39.000Z,139,257,652,neu#bitcoin,aantonop,1469101279,570361,"b'Every month I do a Q&amp;A livestream. I take questions from Patreon Community Builders first, and then others. If you\\u2019re curious what they\\u2019re like, check out February\\u2019s where we chatted about paper wallets, criminals using #bitcoin, &amp; more: https://t.co/2Nsv2D4Zq7 https://t.co/dqCHOZcfnX'",2021-03-15T08:00:15.000Z,6,4,40,neu#bitcoin,aantonop,1469101279,570361,"b'Ignore the noise. Learn about #Bitcoin, get a #crypto lifeboat, and then help someone else get theirs. Learn what I mean with my latest talk: https://t.co/NmljpasAtU https://t.co/DCbO1njsjT'",2021-03-13T09:01:35.000Z,124,31,552,neu#bitcoin,aantonop,1469101279,570361,b'Here\\u2019s what a \\u201cstuck\\u201d #bitcoin transaction means: https://t.co/TwB34TE1ii https://t.co/ohDsTpYntl',2021-03-12T21:00:07.000Z,10,6,59,neu#bitcoin,aantonop,1469101279,570361,b'Looking for information on #bitcoin in another language? The aantonop channel features dozens of subtitled videos in different languages. Please share them with anyone who may need them: https://t.co/rgOqfV22mr https://t.co/hjgxh6sF6Z',2021-03-12T09:00:10.000Z,34,12,131,neu#bitcoin,aantonop,1469101279,570361,"b'Paper wallets, inflation, &amp; criminals using #bitcoin were just a few of February\\u2019s livestream topics. You asked &amp; I answered! Watch: https://t.co/2Nsv2D4Zq7 https://t.co/9rJd8nPgut'",2021-03-12T03:00:06.000Z,25,5,135,neu#bitcoin,aantonop,1469101279,570361,"b'This video recently hit 100k+ views! I\\u2019m so glad you find the #bitcoin basics workshop helpful, and remember, I offer a free Into course on my website that you can take &amp; earn a certificate of completion: https://t.co/3qpqdYfGkq https://t.co/auKnuvZWOL'",2021-03-11T21:00:04.000Z,35,10,181,neu#bitcoin,aantonop,1469101279,570361,"b""Rich people getting into #bitcoin isn't an endorsement of bitcoin. It's that they recognize the fiat ships might all be sinking! Learn more for yourself, learn more to help explain to others: https://t.co/NmljpasAtU https://t.co/o1rtSmxrD4""",2021-03-11T03:00:47.000Z,151,26,665,neu#bitcoin,aantonop,1469101279,570361,b'Every month I host a Q&amp;A livestream session where I answer just about anything regarding #bitcoin &amp; open blockchains. Here\\u2019s February\\u2019s if you haven\\u2019t yet taken a look: https://t.co/2Nsv2D4Zq7 https://t.co/6n0sDDhZFy',2021-03-08T21:00:17.000Z,5,5,48,neu#bitcoin,ErikVoorhees,61417559,429474,b'#Bitcoin will never make you wear a mask to access it. \\n\\nhttps://t.co/zIbF8KCkuH',2021-03-13T17:51:31.000Z,36,61,278,neu#bitcoin,ErikVoorhees,61417559,429474,"b'Until #bitcoin came along, the *character* of money was left undiscussed.'",2021-03-13T04:36:17.000Z,27,20,321,neu#bitcoin,ErikVoorhees,61417559,429474,"b""Pro tip: you can swap all the same tokens WITHOUT Metamask's fees via @ShapeShift_io app...\\n\\nAnd unlike Metamask, we also support #Bitcoin and other non-Ethereum chains.\\n\\nhttps://t.co/rwM8dxT7bs https://t.co/I9y0Z8zo1Z""",2021-03-12T19:27:12.000Z,10,13,59,neu#bitcoin,tyler,24222556,571182,b'There are almost 3 billion video game players worldwide.\\n\\nDo you think they prefer gold or #bitcoin? \\n\\nDo you think they prefer cash or crypto?\\n\\nDo you think they prefer physical art or NFTs?\\n\\nDo you think they prefer Wall Street or DeFi?',2021-03-15T13:03:47.000Z,380,212,2024,neu#bitcoin,tyler,24222556,571182,b'#Bitcoin is your best defense against the Fed',2021-03-14T18:29:09.000Z,311,149,3289,neu#bitcoin,tyler,24222556,571182,"b'While #bitcoin has been ripping, @Filecoin $FIL has been on a tear, up ~30%'",2021-03-14T12:21:58.000Z,81,123,925,neu#bitcoin,tyler,24222556,571182,b'60K is becoming the new foundation for #bitcoin',2021-03-14T12:19:26.000Z,215,134,2964,neu#bitcoin,tyler,24222556,571182,b'#Bitcoin 60k is trending...yeehaw!',2021-03-13T14:55:51.000Z,272,112,3089,neu#bitcoin,tyler,24222556,571182,b'#4WordsBetterThanSex \\n\\n#bitcoin all-time-high',2021-03-13T13:44:02.000Z,362,277,4073,neu#bitcoin,tyler,24222556,571182,b'Good morning 60k #bitcoin https://t.co/it4AXJPhVq',2021-03-13T13:29:56.000Z,356,132,3696,neu#bitcoin,tyler,24222556,571182,b'Androids do dream of electric sheep and #bitcoin',2021-03-12T14:41:49.000Z,61,101,848,neu#bitcoin,tyler,24222556,571182,b'Biden signs off on $1.9 trillion dollar advertisement for #bitcoin',2021-03-11T23:52:09.000Z,1202,290,9170,neu#bitcoin,tyler,24222556,571182,"b'#bitcoin is a journey of truth about the nature of money. It\\u2019s down the rabbit hole, through the looking glass, into the wardrobe, into the upside/down, taking the red pill, and so much more.'",2021-03-11T14:56:27.000Z,251,147,1754,neu#bitcoin,tyler,24222556,571182,b'Stimmy is trending which means #bitcoin will be trending too soon',2021-03-11T00:23:08.000Z,302,155,3667,neu#bitcoin,tyler,24222556,571182,b'The House to vote on $1.9 trillion dollar advertisement for #bitcoin after Senate approval',2021-03-10T18:14:29.000Z,426,164,4084,neu#bitcoin,tyler,24222556,571182,"b""There is a lot institutional money coming into #bitcoin but most of it is still sitting on the sidelines. We're in the second pitch of the first inning.""",2021-03-10T14:41:25.000Z,328,134,3109,neu#bitcoin,tyler,24222556,571182,b'#bitcoin has roared to 55k. Next stop 60k.',2021-03-10T13:21:23.000Z,720,315,7398,neu#bitcoin,tyler,24222556,571182,"b'And another company has decided to put #bitcoin on its balance sheet.\\n\\nAmerican Residential Warranty has teamed up with @Gemini, to invest directly in bitcoin. Onward! \\U0001f680\\n\\nhttps://t.co/IYuVoYoNEg'",2021-03-09T20:56:10.000Z,262,67,1478,neu#bitcoin,tyler,24222556,571182,"b""Another company is putting #bitcoin on it's balance sheet https://t.co/aTwqSRUANn""",2021-03-09T20:27:12.000Z,235,81,1714,neu#bitcoin,tyler,24222556,571182,"b""It's a new week, a new day, and #bitcoin is chilling above 50k. And this is all before $1.9 trillion dollars come into the system.""",2021-03-08T17:06:05.000Z,367,194,3276,neu#bitcoin,cameron,250980843,412432,b'Fiat money has had decades to scale and still has not reached the billion plus unbanked. #Bitcoin is for anyone anywhere the Internet goes...which is everywhere. It is profoundly more socially scalable.',2021-03-14T19:11:46.000Z,215,104,1489,neu#bitcoin,cameron,250980843,412432,b'Stimmy checks must be flooding into #Bitcoin',2021-03-14T13:48:23.000Z,217,176,2697,neu#bitcoin,cameron,250980843,412432,b'Good morning #bitcoin 60K!',2021-03-13T14:10:17.000Z,298,139,3836,pos#bitcoin,cameron,250980843,412432,b'#Bitcoin breaks the frame of the fiat narrative.',2021-03-12T20:24:05.000Z,145,89,1536,neu#bitcoin,cameron,250980843,412432,b'#bitcoin brings scarcity to digital money. NFTs bring scarcity to digital art.',2021-03-10T17:59:20.000Z,263,221,2302,neu#bitcoin,cameron,250980843,412432,"b'Tomorrow, the House is set to give you 1.9 trillion more reasons to own #Bitcoin'",2021-03-10T03:11:18.000Z,629,222,5709,neu#bitcoin,cameron,250980843,412432,b'#bitcoin is everywhere and nowhere. That is the strength of decentralized money.',2021-03-09T14:18:02.000Z,313,176,2913,neu#bitcoin,Cointelegraph,2207129125,700174,"b'.@Athletics are offering fans a full season, six-person suite for the home season at the price of 1#Bitcoin https://t.co/n5G2OBj717'",2021-03-15T09:52:32.000Z,10,7,51,neu#bitcoin,Cointelegraph,2207129125,700174,b'Which #Bitcoin price prediction team are you on? @Michael_Saylor? @100trillionUSD? @APompliano? We have only just begun and there is no telling where we will end up! https://t.co/Ei6fheSCNI https://t.co/Y9HQ202yDt',2021-03-14T12:00:29.000Z,38,17,141,neu#bitcoin,Cointelegraph,2207129125,700174,"b'Goldman Sachs braces for a wave of crypto customers. According to their COO, consumers are asking for financial services around digital assets. Can we just get a #Bitcoin ETF already? https://t.co/BcOPqAW6IN'",2021-03-14T07:15:00.000Z,74,19,359,neu#bitcoin,Cointelegraph,2207129125,700174,"b'Analysts expect Bitcoin and altcoins to soar into uncharted territory after #BTC hit a new high above $61,800. https://t.co/4ntwOJ0r34'",2021-03-14T00:20:32.000Z,45,11,261,neu#bitcoin,Cointelegraph,2207129125,700174,"b'Where were you on March 12, 2020? \\n\\nMany remember this day as Black Thursday when #BTC crashed to $3,600. Things are different this time around, but why? https://t.co/njh9m8cuMB'",2021-03-13T20:00:01.000Z,11,8,74,neu#bitcoin,Cointelegraph,2207129125,700174,b'Over the last week #Bitcoin has returned 25.7%.\\n\\nAn evenly-weighted basket of #Altcoins has returned 28.2%.\\n\\nBuying when our VORTECS\\u2122 Score crosses 80 and selling after 24 hours has returned 66%.\\n\\nGet this data live. https://t.co/odnDIl7J7D https://t.co/QxLyo0POXG',2021-03-13T15:57:34.000Z,8,4,42,neu#bitcoin,Cointelegraph,2207129125,700174,"b'Another weekend, another all-time high for #Bitcoin! Where to next? https://t.co/4cOX0F7tBf'",2021-03-13T14:02:04.000Z,90,24,421,neu#bitcoin,Cointelegraph,2207129125,700174,b'Guessing the price of #Bitcoin is like looking into a crystal ball sometimes. Who has your favorite BTC price prediction? @100trillionUSD? @APompliano? https://t.co/Ei6fheSCNI https://t.co/OuuzIEenLu',2021-03-13T03:15:04.000Z,19,6,99,neu#litecoin,Cointelegraph,2207129125,700174,"b'Much WOW. The website of the Canadian social media platform, Pal, crashed minutes after it announced the acquisition of a 15% stake in a #DOGE and #LTC mining facility. Why all the hype? https://t.co/tnc5AfUEaM\\n\\n(Reporting via @OsatoNomayo)'",2021-03-13T01:20:00.000Z,18,3,75,neu#dogecoin,Cointelegraph,2207129125,700174,"b'Much WOW. The website of the Canadian social media platform, Pal, crashed minutes after it announced the acquisition of a 15% stake in a #DOGE and #LTC mining facility. Why all the hype? https://t.co/tnc5AfUEaM\\n\\n(Reporting via @OsatoNomayo)'",2021-03-13T01:20:00.000Z,18,3,75,neu#bitcoin,Cointelegraph,2207129125,700174,"b'Where were you on March 12, 2020? \\n\\nMany remember this day as Black Thursday when #Bitcoin crashed to $3,600. Things are different this time around, but why? https://t.co/njh9m8cuMB'",2021-03-12T22:20:02.000Z,12,4,42,neu#bitcoin,Cointelegraph,2207129125,700174,b'Guessing the price of Bitcoin is like looking into a crystal ball sometimes. Who has your favorite #BTC price prediction? @100trillionUSD? @APompliano? https://t.co/Ei6fheSCNI https://t.co/qn4umHXxns',2021-03-12T21:30:20.000Z,5,6,49,neu#bitcoin,Cointelegraph,2207129125,700174,b'#Bitcoin could soon face a fresh miner sell-off if this metric repeats its historical performance. https://t.co/LBF1ou46a2',2021-03-12T08:56:33.000Z,7,7,36,neu#bitcoin,Cointelegraph,2207129125,700174,"b""Ever wonder what goes on behind the scenes with the #Bitcoin market? \\n\\nArbitrage is an important aspect that we don't always see, but once we pull back the curtain we find that this can keep BTC\\u2019s price similar across exchanges. https://t.co/Je7zoavgaq""",2021-03-12T05:00:32.000Z,7,2,21,neu#bitcoin,Cointelegraph,2207129125,700174,"b'We aren\\u2019t the only ones who are crypto-hungry! \\n\\n@GoldmanSachs has seen a rise in #Bitcoin demand from its clients, but to what extent are they willing to explore the crypto world? https://t.co/BcOPqAW6IN'",2021-03-12T01:40:00.000Z,17,1,52,neu#ethereum,Cointelegraph,2207129125,700174,b'Should #Ethereum be worried about the latest Tether integration with @Solana? \\n\\nThe Ethereum competitor blockchain promises to support DeFi and other Web3 activities at higher transaction speeds and lower costs. https://t.co/5kbvDeFx1o',2021-03-12T00:20:01.000Z,12,7,89,neu#bitcoin,Cointelegraph,2207129125,700174,"b""Ever wonder what goes on behind the scenes with the Bitcoin market? \\n\\nArbitrage is an important aspect that we don't always see, but once we pull back the curtain we find that this can keep #BTC\\u2019s price similar across exchanges. https://t.co/Je7zoavgaq""",2021-03-11T23:20:00.000Z,3,4,23,neu#ethereum,Cointelegraph,2207129125,700174,b'#DeFi projects are integrating additional blockchain projects like #BinanceSmartChain. Is this the end of #Ethereum dominance in DeFi? https://t.co/7zkkIGfW6N',2021-03-11T18:50:03.000Z,18,14,72,neu#bitcoin,Cointelegraph,2207129125,700174,b'Ever wonder why #Bitcoin usually trades close to the same price on most crypto exchanges? @benjaminpirus reports on some rationale behind $BTC price action. https://t.co/SmzSq0DvG1',2021-03-11T15:04:04.000Z,9,2,31,neu#bitcoin,Cointelegraph,2207129125,700175,"b""Guests at the Kessler Collection's hotels can now pay using #Bitcoin and other cryptocurrencies following a recent partnership with BitPay. https://t.co/Zp2akc4Elw""",2021-03-11T12:36:02.000Z,20,6,78,neu#bitcoin,Cointelegraph,2207129125,700175,"b'BlackRock\'s Russ Koesterich says gold\'s status as a hedge against inflation is ""somewhat exaggerated."" Is #Bitcoin a better haven asset? https://t.co/SgkOeLdHlN'",2021-03-11T11:05:05.000Z,26,2,95,neu#bitcoin,Cointelegraph,2207129125,700175,b'The son of famous Bitcoin naysayer Peter Schiff has supposedly sold his silver stocks to put a 100% bet on #Bitcoin. https://t.co/2v33OeYJ2t',2021-03-11T09:04:03.000Z,69,31,370,neu#bitcoin,Cointelegraph,2207129125,700175,"b""#Bitcoin wobbles at $57,000 but @mikemcglone11 predicts it could challenge Amazon's market cap next. https://t.co/h05An9l7Wo""",2021-03-11T08:32:03.000Z,24,10,104,neu#ethereum,Cointelegraph,2207129125,700175,b'More staking and yield farming for everyone! @Dashpay is the latest project to offer this functionality after officially launching its #Ethereum DeFi bridge. https://t.co/jR610qN6NX\\n\\n(Reporting via @OsatoNomayo)',2021-03-11T08:20:01.000Z,7,3,40,neu#bitcoin,Cointelegraph,2207129125,700175,"b'Can you believe that nearly 10,000 new #BTC ATMs have been installed since March 1st, 2020? The U.S., Canada, and Europe account for most of these ATMs worldwide. https://t.co/dHXd1fEWnU'",2021-03-11T00:40:00.000Z,29,6,99,neu#dogecoin,Cointelegraph,2207129125,700175,b'Has #Dogecoin overstayed its welcome or is it here to stay? As more and more celebrities are endorsing the meme coin we could see more DOGE adoption in our future. https://t.co/JP6ERec4xz',2021-03-10T23:20:01.000Z,17,18,79,neu#bitcoin,Cointelegraph,2207129125,700175,"b'Key Bitcoin derivatives indicators signal that the rally to $57,000 was not driven by overleveraged retail traders, @noshitcoins explains why #BTC price could move higher. https://t.co/630dMSRpW6'",2021-03-10T20:36:02.000Z,12,8,47,neu#xrp,Cointelegraph,2207129125,700175,b'Ripple drops the lawsuit against YouTube after an out-of-court settlement.\\n\\nThe suit alleged that YouTube was benefiting from #XRP scam giveaways that flooded the video streaming platform. https://t.co/RKHwvvivlm\\n\\n(Reporting via @gregthomson88)',2021-03-10T20:15:08.000Z,7,4,30,neu#ethereum,Cointelegraph,2207129125,700175,b'Did we just discover a graphics card hack? A custom modification can allegedly bypass the RTX 3060\\u2019s mining limitations. This could be great news for #ETH miners. https://t.co/RC9NTpQbPi',2021-03-10T18:30:05.000Z,9,7,48,neu#xrp,Cointelegraph,2207129125,700175,b'Ripple drops the lawsuit against YouTube after an out-of-court settlement.\\n\\nThe suit alleged that @YouTube was benefiting from #XRP scam giveaways that flooded the video streaming platform. https://t.co/RKHwvvivlm\\n\\n(Reporting via @gregthomson88)',2021-03-10T14:00:00.000Z,6,1,17,neu#bitcoin,Cointelegraph,2207129125,700175,b'The U.S. and Canada continue to account for the vast majority of #Bitcoin ATMs internationally. https://t.co/Oqph8tpVxP',2021-03-10T10:53:02.000Z,24,10,88,neu#bitcoin,Cointelegraph,2207129125,700175,b'Aker Solutions just made a big bet on Bitcoin by spinning up a new crypto investment company to tap into the #BTC ecosystem. Will the $59 million investment from Aker Solutions pay off? https://t.co/qO4ToDCAsM',2021-03-10T09:40:00.000Z,33,7,132,neu#bitcoin,Cointelegraph,2207129125,700175,b'More institutions are jumping aboard the crypto train! Aker ASA is the latest firm to announce they will hold #Bitcoin on their balance sheet and invest in companies in the crypto space. https://t.co/EDwmFaiY51\\n\\n(Reporting via @OsatoNomayo)',2021-03-09T07:20:00.000Z,30,5,118,neu#ethereum,Cointelegraph,2207129125,700175,"b'Which blockchain will central banks decide to host CBDCs? According to a report from CPA Australia, the big three in the running are Bitcoin, #Ethereum, and XRP. https://t.co/7wNKls8j3A'",2021-03-09T04:45:01.000Z,28,25,93,neu#bitcoin,Cointelegraph,2207129125,700175,b'This toddler HODLer is becoming a blockchain rockstar! Lily Knight appeared at the Women of the Future conference on Monday and shared some #BTC enthusiasm with the crypto community. https://t.co/GwRVDyN2fl',2021-03-09T04:30:02.000Z,21,1,74,neu#bitcoin,Cointelegraph,2207129125,700175,b'WOW. NYDIG just announced a $200M funding round for their business initiatives relating to #Bitcoin. Strategic partners such as @MorganStanley and @MassMutual were among those who led the funding. https://t.co/8xvuYnqOm9',2021-03-09T03:45:01.000Z,16,1,64,neu#bitcoin,Cointelegraph,2207129125,700175,b'On-chain data shows that 1.2 million #Bitcoin (6.5% of circulating supply) recently moved to create \\u201cone of the largest on-chain BTC accumulation levels in history.\\u201d https://t.co/wpSGF5UQtI',2021-03-09T03:13:03.000Z,28,4,101,neu#bitcoin,Cointelegraph,2207129125,700175,b'This toddler HODLer is becoming a blockchain rockstar! Lily Knight appeared at the Women of the Future conference on Monday and shared some #Bitcoin enthusiasm with the crypto community. https://t.co/GwRVDyN2fl',2021-03-08T23:40:01.000Z,13,3,40,neu#bitcoin,Cointelegraph,2207129125,700175,"b'Which blockchain will central banks decide to host CBDCs? According to a report from CPA Australia, the big three in the running are #Bitcoin, Ethereum, and XRP. https://t.co/7wNKls8j3A'",2021-03-08T23:20:00.000Z,19,16,67,neu#chiliz,Cointelegraph,2207129125,700175,b'#Chiliz\\u2019s market cap soared above $1 billion as $CHZ token hit a new all-time high and plans to expand to the United States boost sentiment among sports fans and investors. https://t.co/4Ua5E8zDah',2021-03-08T23:18:32.000Z,239,73,995,neu#dogecoin,Cointelegraph,2207129125,700175,b'John McAfee speaks out against charges brought against him by the DOJ. He says that the tweets he made about #Dogecoin in 2017 should not be included in the pump-and-dump allegations. But why? https://t.co/RB7H2MLcEt',2021-03-08T20:45:03.000Z,3,7,17,neu#bitcoin,Cointelegraph,2207129125,700175,"b""The haven battle between gold and #Bitcoin clearly favors BTC, according to Bloomberg's @mikemcglone11 https://t.co/FuknSjZe3d""",2021-03-08T16:49:32.000Z,16,4,67,neu#bitcoin,crypto,928759224599040001,294695,"b'#Bitcoin stays in sight of record above $61,000 after 1,000% jump https://t.co/IkS8xemjcG \\n\\nMore on @crypto: https://t.co/DMktgnfiOV #Cryptocurrency $BTC https://t.co/PCCEsN1fej'",2021-03-15T06:52:17.000Z,18,8,64,neu#bitcoin,crypto,928759224599040001,294695,"b'WATCH: #Bitcoin may rise to $175,000 by year end, says Richard Byworth, chief executive officer of Diginex, a Nasdaq-listed digital asset financial services company https://t.co/OdtgRIHoUR via @BloombergTV \\n\\nMore on @crypto: https://t.co/oEK4jxYHtv #Cryptocurrency $BTC $EQOS https://t.co/cfhg71bMzC'",2021-03-15T04:35:17.000Z,81,22,233,neu#bitcoin,crypto,928759224599040001,294695,"b'#Bitcoin dips from a record after scaling $61,000 aided by stimulus https://t.co/bxfjBQPHpR \\n\\nMore on @crypto: https://t.co/kMzxlsaMtT #Cryptocurrency $BTC https://t.co/U2LrsxnbM3'",2021-03-15T02:44:45.000Z,47,34,114,neu#bitcoin,crypto,928759224599040001,294695,"b""Here's everything you need to know about #Bitcoin now https://t.co/Y8KSoCOyWF\\n\\nMore on @crypto: https://t.co/BeQi4v7U3C #Cryptocurrency $BTC https://t.co/58SrAI0z0b""",2021-03-13T15:12:02.000Z,41,22,89,neu#bitcoin,crypto,928759224599040001,294695,"b'Beeple #NFT sold for $69 million, making it the third-most expensive artwork to sell at auction - ever https://t.co/JFw8wmYPBr \\n\\nMore on @crypto: https://t.co/msfh3RV4Le #Bitcoin #Cryptocurrency $ETH https://t.co/DM0lcalqdM'",2021-03-12T12:30:22.000Z,25,13,89,neu#bitcoin,crypto,928759224599040001,294695,b'Gold and #Bitcoin? @ScouseView ponders where to turn if rumors of the death of the bond market rally really do come true https://t.co/e6rL5Qi0IC via @bopinion\\n\\nMore on @crypto: https://t.co/ueiGpxiC1l https://t.co/bT8h8PPIuN',2021-03-12T08:55:03.000Z,47,9,115,neu#bitcoin,crypto,928759224599040001,294695,"b'Binance, the world\\u2019s largest #cryptocurrency exchange, has named former U.S. Senator Max Baucus as a policy and government-relations adviser. MORE: https://t.co/lv8LsavVpL\\n\\nMore on @crypto: https://t.co/sHkUvaoa2W #Bitcoin $BNB https://t.co/4MIL8pSFo4'",2021-03-12T08:03:34.000Z,59,8,187,neu#bitcoin,crypto,928759224599040001,294695,"b""Grayscale Investments, the firm behind the biggest #Bitcoin trust, has posted at least nine ETF-related positions to LinkedIn, a signal that it's betting on U.S. approval for crypto ETFs https://t.co/nX084ZM6Qs\\n\\nMore on @crypto: https://t.co/Rxo1fzp6yB #Cryptocurrency https://t.co/QN7cfys1qF""",2021-03-12T07:01:07.000Z,56,15,217,neu#bitcoin,crypto,928759224599040001,294695,"b'FalconX, a #cryptocurrency trading platform, raised $50 million from investors including Tiger Global Management and B Capital Group, sources say https://t.co/GnFSmT7XRJ\\n\\nMore on @crypto: https://t.co/8EKgdFNNHQ #Bitcoin https://t.co/m7y73Xm3TB'",2021-03-12T04:28:07.000Z,26,2,47,neu#bitcoin,crypto,928759224599040001,294695,b'How to sound smart when talking about #Bitcoin these days https://t.co/8mJAexrXzO\\n\\nMore on @crypto: https://t.co/Cg1xMDq2Oy #Cryptocurrency https://t.co/s09OqQPntj',2021-03-12T04:03:09.000Z,51,17,101,neu#bitcoin,crypto,928759224599040001,294695,"b'World\\u2019s largest #cryptocurrency is picking up momentum once again, approaching its record high set last month amid a broader risk-on rally in financial markets https://t.co/gI2V6VozMK\\n\\nMore on @crypto: https://t.co/0hV5BEXtUF #Bitcoin $BTC https://t.co/pSHocYUr7E'",2021-03-12T03:08:59.000Z,64,7,139,neu#bitcoin,crypto,928759224599040001,294695,b'Here are a few of the tactics people are using to get their money out of China right now https://t.co/5tLUzQaxlv \\n\\nMore on @crypto: https://t.co/WFPGdif5T4 #Bitcoin #Cryptocurrency https://t.co/X3EJMLHqA2',2021-03-12T02:48:37.000Z,50,8,80,neu#bitcoin,crypto,928759224599040001,294695,"b'""One day, alright, I\\u2019m broke. Now I\\u2019m a millionaire."" Artists are cashing in on the #NFT craze, which allows them to create a stamp of ownership on their work https://t.co/fhR87fEQKx \\n\\nMore on @crypto: https://t.co/EeNBhoWTvk #Bitcoin #Cryptocurrency https://t.co/Hz8mhjdBck'",2021-03-10T02:38:15.000Z,22,12,74,neu#bitcoin,crypto,928759224599040001,294695,"b'NEW: #Bitcoin breaks through $55,000 as risk appetite returns and recent trends signal digital tokens are stepping closer to mainstream finance https://t.co/JXwyFXBuEd\\n\\nMore on @crypto: https://t.co/nP4e9dz5C4 https://t.co/riCSmz8hyn'",2021-03-10T02:01:10.000Z,43,11,126,neu#bitcoin,crypto,928759224599040001,294695,"b'JUST IN: #Bitcoin extends climb, topping $55,000 as risk appetite revives https://t.co/RgBJn7Bhza'",2021-03-10T02:00:58.000Z,19,7,60,neu#bitcoin,crypto,928759224599040001,294695,b'#Bitcoin rose to its highest level since Feb. 23 on Tuesday during continued interest in digital assets from big institutions https://t.co/gqcS4PnAGC',2021-03-09T07:43:20.000Z,17,7,66,neu#bitcoin,crypto,928759224599040001,294695,b'Imagine a future where national and private digital currencies can easily be substituted. @andymukherjee70 says it could be here in a decade https://t.co/YBgcZbIveg via @bopinion \\n\\nMore on @crypto: https://t.co/guIrn9B9vq #Bitcoin https://t.co/8tQt4RNMpc',2021-03-09T07:20:47.000Z,15,6,62,neu#bitcoin,crypto,928759224599040001,294695,"b'\\u201cBitcoin and Ethereum bullishness are back.""\\n\\nThe largest #cryptocurrency and its rival reached its highest point in two weeks, in the wake of Chinese beauty app Meitu saying it had bought not just #Bitcoin, but #Ether as well https://t.co/zL2nsxPU2V $BTC $ETH https://t.co/RrM8UdKNtk'",2021-03-09T04:17:53.000Z,104,18,276,neu#ethereum,crypto,928759224599040001,294695,"b'\\u201cBitcoin and Ethereum bullishness are back.""\\n\\nThe largest #cryptocurrency and its rival reached its highest point in two weeks, in the wake of Chinese beauty app Meitu saying it had bought not just #Bitcoin, but #Ether as well https://t.co/zL2nsxPU2V $BTC $ETH https://t.co/RrM8UdKNtk'",2021-03-09T04:17:53.000Z,104,18,276,neu#bitcoin,crypto,928759224599040001,294695,b'The U.S. government is auctioning off an unusual item: 0.7501 of a #Bitcoin https://t.co/TAsHmhxYwr \\n\\nMore on @crypto: https://t.co/ySk0V0vrBE https://t.co/UGiPmrC4ee',2021-03-09T00:20:48.000Z,87,30,230,neu#bitcoin,laurashin,26377478,140817,b'$60k #btc!',2021-03-13T12:34:31.000Z,20,13,355,neu#bitcoin,laurashin,26377478,140817,"b'.@EliBenSasson says that with payments, @StarkWareLtd can process 18,000 transactions per second.\\n\\n@ethereum can only process about 15 tps, and #Bitcoin, ~7 per second. \\U0001f440\\n\\nWith 80,000 on the @dydxprotocol waitlist, what do you think -- should they be nervous about going live? https://t.co/pf8n9s6dlH'",2021-03-10T14:33:31.000Z,14,10,65,neu