cryptocurrency,username,user_id,followers_count,tweet_text,created_date,retweet_count,reply_count,like_count,sentiment#binance coin,cz_binance,902926941413453824,1360597,"Sorry, didn't see this. It looks like #BNB made an ATH earlier today before the previous tweet. My bad.

Yeah, ATH... 

Not financial advice. https://t.co/9d58ZW2ITp",2021-04-02T05:23:03.000Z,655,28,4532,neu
#bitcoin,cz_binance,902926941413453824,1360593,"I am thinking of buying 1 #BTC worth of fiat. 

Not financial advice. And happy April Fools!",2021-04-01T07:54:36.000Z,544,715,6336,neu
#bitcoin,woonomic,13418472,381395,"Due to the changing face of #Bitcoin investors in 2021, The Bitcoin Forecast will move into audio form to better suit the needs of corporate directors during boardroom meetings.

Here's a free sample:
https://t.co/QkWZVLB0qg",2021-04-01T04:05:05.000Z,103,148,1258,neu
